No,Sourced Statements,Type of Source,Name of Source,Title of Source,Source Justification
1,"“What up, n*gger!” he says.",Document,,,"The viral video, recorded in what looks like a high school cafeteria, starts innocuously enough. Jeremiah Mason — a Black student at Fresno Christian Schools in Fresno, California —  munching on chicken fingers. Then, another student walks in and greets Mason.
"
2,"“I shared it ultimately with the president of the [Fresno Christian] board,” J. Mason, Jeremiah’s father, told yourcentralvalley.com, a local news outlet. “He told me, ‘Hey, yeah, we’re going to do something about this.’ But I waited for 11 days and didn’t receive any information. I didn’t hear anything.”",Named Person,J. Mason ,,Jeremiah’s father
3,“I think it’s literally anti-Christian” J. Mason told the local NBC affiliate last week. “You’re setting the team back” because people see how Christians treat a Black student — “your own people at your own school.”,Named Person,J. Mason ,,Jeremiah’s father
5,"Last fall, a Black student filed suit against his prestigious private Christian academy in Westlake Village, also in suburban Los Angeles. The student alleged years of racial harassment from peers, including the use of the N‑word, a mock slave auction in the cafeteria, threats of lynching, and even a whipping sound app used to intimidate him. The lawsuit claims staff witnessed some incidents but failed to intervene effectively.",Document,,,
6,"And in Kentucky in 2023, a federal lawsuit filed against the Diocese of Covington alleged a Black eighth grader at St. Joseph Catholic School was harassed with racial slurs by a teacher, including the use of the N-word during a lesson. The teacher then allegedly retaliated against the girl for reporting the behavior, and she was denied Communion during Mass.",Document,a federal lawsuit filed against the Diocese of Covington,,
7,"In a public statement, Fresno Christian Schools said it “takes all allegations of racial discrimination seriously” and acknowledged that J. Mason had raised concerns about racism earlier this year, and also requested financial compensation.",Named Organization, Fresno Christian Schools ,,
8,"J. Mason said he asked to be reimbursed for the tuition he paid, given that Jeremiah did not feel safe or welcome on campus.",Named Person,J. Mason ,Jeremiah’s father, given that Jeremiah did not feel safe or welcome on campus.
9,"Jeremiah has since graduated and J. Mason said he just wants the school to be safe for incoming Black Christian students. But if it won’t take what happened to Jeremiah seriously, it’s a sign the school refuses “to listen to the Holy Spirit,” he said.",Named Person,J. Mason ,Jeremiah’s father,