No,Sourced Statements ,Type of source,Anomynity? (Y/N),Name of Source,Title of Source,Source Justification
1,"Under SB 1015, the State would ensure clinical placement opportunities for California’s future nurses, including nurses attending community colleges, state universities, and other public institutions. ",Document,,SB 1015,,
2,"Sen. Cortese said that SB 1015 ensures that the state meets the growing demand in the nursing field.
",Named individual,,Dave Cortese,"Senator, (D-San Jose)",
3,"“As California’s population ages and becomes increasingly more diverse, we will need a qualified and experienced nursing workforce to meet the unique demands and varied needs of all patients. That is why we must have appropriate nurse staffing levels which have proven to reduce mortality rates, reduce hospital length of stays, and reduce the number of preventable events such as falls and infections,” said Cortese.
",Named individual,,Dave Cortese,"Senator, (D-San Jose)",
4,"According to the Board of Registered Nursing, 92 out of 152 publicly funded nursing programs were denied access to clinic placements. 
",Named Organization,,Board of Registered Nursing,,
5,The program officials reported that the inability to secure clinical placements is one of the main reasons for not enrolling more students.,Unnamed Group of People,,Program officials,,
6,"Cathy Kennedy, a Registered Nurse and president of the CNA, said that SB 1015 helps nursing students receive a clinical education and placement amid the nationwide staffing crisis, despite their socioeconomic background.
",Named individual,,Cathy Kennedy,"Registered Nurse, and President, California Nurses Assocation",
7,"“Clinical education is an essential part of any nurse’s education, yet aspiring nurses, especially students in public programs, are being denied access to clinical placements,” said Kennedy.
",Named individual,,Cathy Kennedy,"Registered Nurse, and President, California Nurses Assocation",
8,"“We applaud the California Senate for passing S.B. 1015. It is commonsense reform that will increase transparency and increase oversight from the Board of Registered Nursing,” she added.
",Named individual,,Cathy Kennedy,"Registered Nurse, and President, California Nurses Assocation",