No,Sourced Statements,Type of Source,Name of Source,Title of Source,Source Justification
1,"The University of California will enroll fewer new California students if planned state cuts are implemented, college officials told state lawmakers during a hearing today on the system’s finances.  ",Unamed Group of People,college officials,,college officials told state lawmakers during a hearing today on the system’s finances.  
2,"“University of California cannot afford to continue increasing enrollment with less funding, it just can’t,” said UC’s top academic officer, Katherine Newman, at an Assembly budget subcommittee hearing. “If the state cuts the university by 8%, we will be forced to decrease enrollment for the fall of 2026 admission cycle.” ",Named Person,Katherine Newman ,UC’s top academic officer,
3,"“So blowing up class sizes, reducing advising, limiting opportunities for our students: This is not a recipe for the continued success at the University of California, and we would not want to go in that direction,” Newman said. ",Named Person,Katherine Newman ,UC’s top academic officer,
4,But an Assembly legislative analysis calculated that other state agencies are experiencing much lower cuts — around 2% or 3%.,Named Organization,California State Assembly,,
5,"About 50 members of the Assembly signed letters opposing the proposed university cuts, the meeting agenda said.",Document,,Meeting agenda ,
6,"“However, given numerous General Fund pressures facing the state, it is unclear whether the Legislature will have the ability to restore the cuts,” the agenda for today’s hearing said.",Document,,Meeting agenda ,
7,"The chair of the Assembly’s budget subcommittee on education finance, David Alvarez, a Democrat from Chula Vista, asked UC senior officials how much the state could cut and still leave student academics largely unaffected, including graduation rates and other endeavors that “ensure that student access remains the same.”",Named Person,David Alvarez,The chair of the Assembly’s budget subcommittee on education finance & a Democrat from Chula Vista,
8,"For UC San Diego Chancellor Pradeep Khosla, the answer was about $30 million, much less than the roughly $73 million in state cuts the campus would absorb under the current plan.",Named Person,Pradeep Khosla,UC San Diego Chancellor,
9,"Systemwide, the UC’s 10 campuses could tolerate an ongoing cut of $125 million, said Seija Virtanen, a UC government relations official.",Named Person,Seija Virtanen, UC government relations official,